researcher_id,author_name,paper_id,title,authors,co_authors_count,citations,year,journal
43,Rachel Johnson,R43_P13,However yard difficult describe,Rachel Johnson; Jasmine Crane; Christopher House; Courtney Smith; Olivia Duarte; Reginald Scott; Morgan Perez,6,377,1980,Centralized contextually-based Internet solution Journal
43,Rachel Johnson,R43_P14,Chair chance let seat happy by,Rachel Johnson; Christina Wolf; Victoria Brown; Sara Hobbs; Thomas Russell; Cheyenne Vasquez; Willie Anderson; Heather Ross,7,339,2007,Cross-group intermediate migration Journal
43,Rachel Johnson,R43_P15,Let time strategy sport market,Rachel Johnson; George Riley,1,271,2019,Visionary zero administration model Journal
43,Rachel Johnson,R43_P16,Response station safe research apply,Rachel Johnson; Lauren Thomas; Timothy Johnson; Alexandra Gonzalez; Philip Vega; Kimberly Cochran; Douglas Ross,6,91,2021,Customer-focused 5thgeneration emulation Journal
43,Rachel Johnson,R43_P17,Population through personal actually let key,Rachel Johnson; Rebecca May; Timothy Byrd; Jason Hopkins; Stephanie Delgado; Jacob Mccarthy; Nicholas Vazquez; John Horton; Julie Barnett; Alvin Clark,9,186,2013,Visionary attitude-oriented capacity Journal
43,Rachel Johnson,R43_P18,Positive yard owner mission guy,Rachel Johnson; Nicholas Anderson; Cindy Lang MD; Lisa Lawson; Megan Holmes; Daniel Steele; Christopher Wheeler,6,420,1986,Digitized responsive knowledge user Journal
43,Rachel Johnson,R43_P19,White something single race road campaign,Rachel Johnson; Jeffrey Mcdowell; Kelly Little; Jennifer Ellis; Kathleen Ruiz DVM; Laura Patel,5,479,2004,Multi-layered web-enabled paradigm Journal
43,Rachel Johnson,R43_P20,Group past three a month continue chair like,Rachel Johnson; Brian Gomez; Dana Rhodes; Kenneth Odom; Larry Gilbert; Donna Harris; Erica Manning; Jeffrey Bates,7,32,1986,Fully-configurable client-server open architecture Journal
43,Rachel Johnson,R43_P21,Around make all change system administration chair,Rachel Johnson; Julie Harris; Connie Paul; Noah Douglas; Nathan Serrano; Nicholas Mitchell; Debra Lewis; Jessica Myers; Lauren Johnson; Joshua Jordan,9,243,1991,Multi-layered dedicated archive Journal
43,Rachel Johnson,R43_P22,Debate teach child finally under language,Rachel Johnson; Stacie Burton; John Howard; Todd Davis; Rebecca Buchanan DDS; Craig Davis,5,15,2015,Up-sized upward-trending adapter Journal
43,Rachel Johnson,R43_P23,Point nice address glass make east,Rachel Johnson; Jeffrey Andrews; Thomas Mcguire; Tracy Ryan; Sonia Manning; Theresa Nguyen; Laura Hopkins; Gregory Archer,7,460,2015,Operative explicit throughput Journal
43,Rachel Johnson,R43_P24,Sometimes field last bed more send maybe,Rachel Johnson; Denise Ochoa; Larry Powell; Daniel Williams,3,110,1988,Reactive content-based intranet Journal
43,Rachel Johnson,R43_P25,Change and team population,Rachel Johnson; Jean Long; Margaret Baker; Raymond Hall; Jared Rivera; Chelsea Garcia MD; David Hayes; Joshua Clark; Jennifer Roberts,8,159,2012,Diverse value-added Graphic Interface Journal
43,Rachel Johnson,R43_P26,Sort deep I kid least same old price,Rachel Johnson; Jessica Lopez; George Mercer; Kenneth Becker; Veronica Arnold; Jonathan Howe; Justin Fowler; Ronald Martinez; Connie Robinson; Joshua Espinoza,9,470,1987,Optimized 24hour framework Journal
43,Rachel Johnson,R43_P27,Spring middle firm a,Rachel Johnson; Carol Morgan; Cheryl Stone; Shawn Johnson; Edward Gomez; Victor Davis; Anthony Adkins,6,44,1983,Switchable impactful ability Journal
43,Rachel Johnson,R43_P28,Parent side break tree personal,Rachel Johnson; Amanda Kelly; Brandon Hess; Courtney Mcfarland,3,103,2008,Streamlined background policy Journal
43,Rachel Johnson,R43_P29,Maybe some manage low,Rachel Johnson; Maria Bishop; Samuel Mann,2,488,2013,Open-source national intranet Journal
43,Rachel Johnson,R43_P30,Admit truth reduce outside base while,Rachel Johnson; Robert Jones; Kenneth Martin; Justin Mcmahon; Deborah Wade; Samantha Woods; Taylor Ruiz; Justin Cruz,7,411,2023,Versatile next generation structure Journal
43,Rachel Johnson,R43_P31,According human attention truth water consider increase,Rachel Johnson; Bonnie Johnson; Anthony Price; Jacqueline Jones MD; Carol Wilson,4,217,2005,Universal local extranet Journal
43,Rachel Johnson,R43_P32,My tonight project capital,Rachel Johnson; Maria Hall; Sarah Howe; Christopher Howard; Katie Simpson; Brandy Patterson; Brian Mitchell; Lindsay Peters; Meredith Davies; Sarah Keith,9,103,1984,Optional actuating project Journal
44,Madeline Duncan,R44_P1,Grow gas become cell any,Madeline Duncan; Jay Stone; Donald Garcia,2,467,1990,Open-architected neutral application Journal
44,Madeline Duncan,R44_P2,Education section southern,Madeline Duncan; Sherri Miles; Kathryn Garcia; Raymond Randall; Justin Baker; Heather Wilkins; Michael Atkinson,6,142,2020,Team-oriented next generation throughput Journal
44,Madeline Duncan,R44_P3,Still realize lead future it newspaper,Madeline Duncan; Marcia Rocha; Matthew Freeman; William Miller; Luke Smith; Jordan Villarreal; Susan White; Megan Burton,7,16,2021,Managed motivating alliance Journal
44,Madeline Duncan,R44_P4,Painting there southern crime believe visit,Madeline Duncan; Kathleen Warren; Becky Hays; Jaime Stone; Alexis Church; Jasmine Franklin; James Martinez; Chad Ball; Adam Lopez; Bethany Morton,9,440,1989,Horizontal logistical initiative Journal
44,Madeline Duncan,R44_P5,Young push low animal how her stuff second,Madeline Duncan; Elizabeth Moore; Samantha Crawford; Brandon Pace,3,300,1990,Open-architected neutral policy Journal
44,Madeline Duncan,R44_P6,Which future game sea,Madeline Duncan; April Morris; Sara Parker; Arthur White; Samuel Morgan; Mark Odonnell,5,460,1987,Inverse client-server focus group Journal
44,Madeline Duncan,R44_P7,Could budget evening truth,Madeline Duncan; Lonnie Calderon; Matthew Allen; Mitchell Martinez; Sophia Morse,4,359,2010,Focused full-range customer loyalty Journal
44,Madeline Duncan,R44_P8,Rise society everyone recognize sometimes,Madeline Duncan; Andre Berger,1,411,2017,Reduced encompassing firmware Journal
44,Madeline Duncan,R44_P9,Reason song culture successful letter,Madeline Duncan; Leslie Stephens; Elizabeth Avila; Brian Arias; Brandon Vasquez; Sharon Santana; Kathryn Delgado,6,215,2010,Pre-emptive multimedia definition Journal
44,Madeline Duncan,R44_P10,Character financial wind gas leg sign,Madeline Duncan; Jessica Robinson; Jonathan Hayes,2,488,2005,Balanced systemic open system Journal
44,Madeline Duncan,R44_P11,Indicate short feel mission,Madeline Duncan; Christie Todd; Mark Edwards V,2,240,1984,Horizontal zero-defect hardware Journal
44,Madeline Duncan,R44_P12,Dark bring together wide quickly serious,Madeline Duncan; Erin Mercer; Jacob Spencer; Kayla Ruiz; Dennis Sanders,4,83,2020,Enterprise-wide clear-thinking productivity Journal
44,Madeline Duncan,R44_P13,Mother music wide,Madeline Duncan; Michael Carey; Nathan Anderson; Emily Jones; Cindy Pruitt; Lindsey Garcia; Michelle Foster; Matthew Castillo; Steven Miller,8,458,2012,Optional homogeneous implementation Journal
44,Madeline Duncan,R44_P14,Address hold everyone experience,Madeline Duncan; Richard Harper; Heather Murray; Daniel Jones; Sarah Davis; Samuel Perez; Stacy Floyd,6,433,2006,Fundamental directional ability Journal
44,Madeline Duncan,R44_P15,Success level begin seek second social,Madeline Duncan; Edward Greene; Patrick Daniels MD; Jennifer Jones; Katie Massey; Jamie Gould,5,225,1984,Organized composite process improvement Journal
44,Madeline Duncan,R44_P16,Opportunity material effort lead within detail camera,Madeline Duncan; Lauren Williams; Cindy Martin; Seth Morris; Tanya Gonzales; Daniel Wilson; Tom Rojas,6,389,2001,De-engineered bifurcated hierarchy Journal
44,Madeline Duncan,R44_P17,New finally likely teach eight learn,Madeline Duncan; James Heath; Mrs. Alexandria Chambers,2,445,1993,Progressive didactic website Journal
44,Madeline Duncan,R44_P18,Class yeah system build,Madeline Duncan; Rachel Newman; Kevin Reilly; Kathy Grimes,3,201,2009,Organized homogeneous structure Journal
44,Madeline Duncan,R44_P19,So several card end so out culture,Madeline Duncan; Edwin Maxwell; Yvette Jordan; Philip Mccullough; Vincent Johnson; Harold Hall; David Sloan; Gerald Shepherd; Shawn Hart,8,5,2023,Public-key composite matrices Journal
44,Madeline Duncan,R44_P20,Wonder sometimes goal child end,Madeline Duncan; Shane Curry,1,492,1996,Customizable multi-state protocol Journal
44,Madeline Duncan,R44_P21,Listen remain film report,Madeline Duncan; Rachel King; Anna Norris,2,239,1990,Persistent next generation software Journal
44,Madeline Duncan,R44_P22,Understand scene star southern report of,Madeline Duncan; Benjamin Wright; Christina Garcia; Jennifer Browning; Kenneth Thompson; Jeffrey Vasquez; Keith Ward MD,6,350,2020,Upgradable global paradigm Journal
44,Madeline Duncan,R44_P23,Become either other once detail,Madeline Duncan; Kristi Choi; Rebecca White; Sarah Lee; Alexandria Shepherd,4,271,2014,Compatible demand-driven time-frame Journal
44,Madeline Duncan,R44_P24,Almost avoid difference,Madeline Duncan; Eric Rasmussen; Clifford Gonzalez; Kathryn Moore; Willie Munoz; Sean Warren; Robert Cruz; Samantha Petersen; Alicia Combs,8,251,2005,Open-architected bifurcated hierarchy Journal
44,Madeline Duncan,R44_P25,Garden town difference product,Madeline Duncan; Jesse Mays; Melvin Hughes; Andrew Lowe; Robert Gill; Jeffrey Walker; Jack Lindsey; Jessica Moore; Jack Joyce; Ryan Brewer,9,445,1991,Switchable real-time orchestration Journal
44,Madeline Duncan,R44_P26,Crime should major according break friend question benefit,Madeline Duncan; Megan Harris; Monica Horn; Vincent Coleman; Jordan Watts; Melissa Fisher,5,138,2004,Multi-lateral systemic intranet Journal
44,Madeline Duncan,R44_P27,Gas painting customer get her why technology,Madeline Duncan; Sandra Carter; Michael Lee; Denise Stephenson,3,273,2002,Cloned 5thgeneration system engine Journal
44,Madeline Duncan,R44_P28,Character how manage interest soon,Madeline Duncan; Linda Stokes; Nancy Holmes; Jasmine Montgomery; Mackenzie Compton; Hannah Wilkinson; Cynthia Nash,6,310,1997,Business-focused composite implementation Journal
44,Madeline Duncan,R44_P29,Response can age,Madeline Duncan; Jeremy Jackson; Kristin Nelson; Kelly Ross; Maria Green; Cynthia Ballard; Julian Mcmahon,6,153,1983,Function-based foreground project Journal
44,Madeline Duncan,R44_P30,Hear mother cup,Madeline Duncan; Tammy Carpenter; Lawrence Wright; Elizabeth Yang,3,107,2008,Visionary mission-critical moderator Journal
44,Madeline Duncan,R44_P31,Listen learn area,Madeline Duncan; Denise Bell; Jasmine Thompson,2,58,1996,Balanced tangible focus group Journal
44,Madeline Duncan,R44_P32,Billion soon these imagine might thank,Madeline Duncan; Kevin Harris; Tammy Mcdonald; Deborah Lucero; Stephanie Shields; Danielle Rosales,5,106,1995,Triple-buffered eco-centric algorithm Journal
44,Madeline Duncan,R44_P33,People enough friend chair approach western offer,Madeline Duncan; Andrea Wiley; Mark Graham,2,449,1987,Devolved mobile customer loyalty Journal
44,Madeline Duncan,R44_P34,Foreign hot with energy thing little plant dark,Madeline Duncan; David Davenport; Dennis Lewis; Scott Watson; Kara Lawrence; Allison Stokes; Peter Davidson; Andres Hodges; Jamie Rose,8,140,2009,Polarized national budgetary management Journal
44,Madeline Duncan,R44_P35,Art be suffer record quite build civil,Madeline Duncan; Stephen Ross; Daniel Rodriguez; Joel Cox; Kelly Evans,4,351,2009,Managed intermediate system engine Journal
44,Madeline Duncan,R44_P36,Training eat in may across,Madeline Duncan; Kathy Krause; Austin Williams PhD; Martin Wilson; Jeffery Williams; Jesse Harris; Maria Alexander; Kayla Gonzalez,7,320,1996,Synergistic bi-directional standardization Journal
45,David Skinner,R45_P1,Upon forget expect question test there,David Skinner; Karen Palmer; Chelsea Camacho,2,87,2001,Monitored maximized data-warehouse Journal
45,David Skinner,R45_P2,Sound eight school bar manage mind,David Skinner; Kathryn Adams; Derek Williams; Laura Stewart; Cindy Gonzalez; Mario Murray; Jessica Kirk,6,92,2023,Reactive motivating encryption Journal
45,David Skinner,R45_P3,Person approach sea city street power together parent,David Skinner; Lisa James; Tyler Carson; David Atkinson; Dennis Smith; Jeremiah Day,5,136,1989,Mandatory coherent interface Journal
45,David Skinner,R45_P4,Sound radio decade clear,David Skinner; Sean Burton; Brandon Bray; Alex Anderson; Travis Taylor; Zachary Dickerson,5,35,2007,Decentralized heuristic focus group Journal
45,David Skinner,R45_P5,Feeling themselves site allow,David Skinner; Walter Blankenship; Joseph Fletcher; Jose Ramos; Lindsay Dyer; Kelly Goodman,5,155,2003,Programmable clear-thinking workforce Journal
45,David Skinner,R45_P6,Door stop hear be church certainly,David Skinner; Pamela Berg; Donald Anderson; Tyler Gordon; Jack Lucas; Patricia Logan; Angela Whitehead; Dana Giles; Jay Acosta,8,169,1981,Future-proofed transitional groupware Journal
45,David Skinner,R45_P7,Score law billion son address,David Skinner; Elizabeth Spencer; Ashley Marquez; Andre Armstrong; Donna Joseph; Thomas Johnson; Jennifer Conrad; Harold Wolfe; Christine Callahan,8,54,2006,Secured full-range framework Journal
45,David Skinner,R45_P8,Meet Republican professional land,David Skinner; Elizabeth Saunders; Jonathan Snyder; Shane Wood; Autumn Robinson; Samuel Doyle,5,277,2006,Profound multimedia archive Journal
45,David Skinner,R45_P9,Past admit artist expect former hair work,David Skinner; Emily Watts; Steven Weeks; Ashley Simmons,3,376,2023,Fully-configurable mission-critical policy Journal
45,David Skinner,R45_P10,Small probably major child hair determine,David Skinner; Tara Frank; Dennis Navarro; Eric Casey; Victoria Henry,4,140,1988,Exclusive systematic open system Journal
45,David Skinner,R45_P11,Culture artist executive happy both physical,David Skinner; Jon Hickman; Amy Campbell; Justin Tyler; Marcus Rogers; Tammy Solis; Jessica Grant; Cindy Watson; Mary Lyons,8,437,2006,Synergistic mission-critical infrastructure Journal
45,David Skinner,R45_P12,Approach star partner serve feeling sound oil,David Skinner; Jason Robbins; Bobby Davis; Melanie Hansen,3,33,1980,Virtual intangible instruction set Journal
45,David Skinner,R45_P13,Responsibility lead discuss hospital himself animal visit race,David Skinner; Barry Frazier; Kenneth Stuart; Katie Bell; Veronica Johnson; Phillip Gonzalez; Brian Randall; Christopher Mitchell; Michael Parks; Michelle Shepard,9,159,2008,Visionary cohesive array Journal
45,David Skinner,R45_P14,Amount travel program threat myself player million want,David Skinner; Amy Patel MD,1,326,1982,Optional dynamic methodology Journal
45,David Skinner,R45_P15,Between sense significant it eat think thing,David Skinner; Nancy Stephens; Michael Lopez; Ralph Graham; Mr. Robert Parker,4,467,2009,Innovative executive knowledge user Journal
45,David Skinner,R45_P16,Create range coach manager star image kind,David Skinner; Erin Davis; Kara Summers; Leon Jackson,3,162,2018,Assimilated eco-centric Local Area Network Journal
45,David Skinner,R45_P17,Fill wear himself particular,David Skinner; Ms. Michele Wright,1,90,1997,Networked multi-tasking knowledge user Journal
45,David Skinner,R45_P18,Idea president cultural evidence walk phone,David Skinner; Lauren Smith; Krystal Brooks; Leah Myers; Rhonda Brown,4,172,2008,Inverse full-range workforce Journal
45,David Skinner,R45_P19,Style office so drug,David Skinner; Lorraine Ibarra; James Henry; Anthony Mcdonald; Michael Ayala; James Joseph,5,467,2006,Decentralized stable monitoring Journal
45,David Skinner,R45_P20,Turn religious writer white many each up,David Skinner; Erin Cruz; Stacy Lowe; James Weiss; Veronica Petersen,4,81,1980,Expanded multimedia installation Journal
45,David Skinner,R45_P21,Quality approach good attack same trouble PM,David Skinner; Jeff Fowler,1,113,2005,Persevering motivating info-mediaries Journal
45,David Skinner,R45_P22,Trip close already in effort its,David Skinner; David King; Edgar Miller; Jessica Wright; Sharon Taylor,4,364,2002,Robust empowering data-warehouse Journal
45,David Skinner,R45_P23,Off occur month provide price source impact physical,David Skinner; Eugene Phelps; Joshua Garrett; Susan Whitaker DDS; Tanya Nolan; Zachary Lopez; Kevin Moran DDS; Dan Davis; Thomas Manning; Tracy Doyle,9,265,2020,Fully-configurable fresh-thinking artificial intelligence Journal
45,David Skinner,R45_P24,Character owner more glass too pressure,David Skinner; Elizabeth Decker,1,388,1996,Pre-emptive 6thgeneration alliance Journal
46,Luke Smith,R46_P1,Goal per believe both,Luke Smith; Eugene Baird; Amanda Dunlap; John Dennis; Holly Walker; Adam Potter; Veronica Rodriguez; Joy Morgan; Samantha Rodriguez,8,353,2020,De-engineered methodical adapter Journal
46,Luke Smith,R46_P2,Exist bar call,Luke Smith; Robert White; Gregory Chase; Dakota Miller; Henry Dixon,4,220,1984,Organized disintermediate collaboration Journal
46,Luke Smith,R46_P3,Law forward change lead catch,Luke Smith; David Soto; Anthony Gibson; Adam Small; Paul Wilkinson; Jessica Freeman; Aaron Ford; Benjamin Thompson; Anna Reyes,8,255,2000,Operative well-modulated circuit Journal
46,Luke Smith,R46_P4,Will half somebody off,Luke Smith; Michael Hall; Jacqueline Moreno; Mercedes Donaldson,3,98,1998,Team-oriented radical customer loyalty Journal
46,Luke Smith,R46_P5,To ok could team,Luke Smith; Crystal Hernandez; Michael Gutierrez; Felicia Mcfarland; Brian Johnson; Elizabeth Chase; Amy Mckinney; Amanda Stewart,7,108,1986,Operative full-range leverage Journal
46,Luke Smith,R46_P6,Expect simple rich difference indicate,Luke Smith; Abigail Olson; Melissa Lee; Amy Lane; Diane Sullivan; Cynthia Hickman MD; Anne Ford; Nicole Alexander; Clinton Padilla,8,153,1984,Business-focused real-time definition Journal
46,Luke Smith,R46_P7,Television turn physical not likely,Luke Smith; Ryan Ryan; Brian Gray; Andrew Munoz; Patrick Faulkner DDS,4,404,2002,Secured composite neural-net Journal
46,Luke Smith,R46_P8,Wonder rate return throughout,Luke Smith; Patricia Obrien; Danielle Santos; Daniel Preston IV; Mr. Micheal Scott V,4,361,1994,Front-line 4thgeneration task-force Journal
46,Luke Smith,R46_P9,Fast yeah great chance science number use happy,Luke Smith; Jonathan Shepard; Jacob Ray; Sean Harrison; Erica Thomas,4,241,2008,Networked grid-enabled strategy Journal
46,Luke Smith,R46_P10,Ok standard improve set,Luke Smith; Sandra Sandoval; Sabrina Brown; Kayla Grimes; Allison Obrien; Connie Roberson; Andrea Ramirez; Robin Jones; Anthony Gonzalez; Michael Estrada,9,391,1998,Up-sized contextually-based knowledge user Journal
46,Luke Smith,R46_P11,Left statement surface size be provide less,Luke Smith; Katie Ibarra; Justin Simmons; Nancy Kerr; Alfred Henry; Evan Wheeler; Robert Jennings; Ruth Hernandez MD,7,111,2007,Progressive 4thgeneration hardware Journal
46,Luke Smith,R46_P12,Drive until street value production someone,Luke Smith; Rachel Bishop; Anthony Kelly; Paul Suarez; Jennifer Kennedy; Bryan Anderson; Nicholas Baker; William Porter; Jacqueline Mercer; Mary Landry,9,493,2006,Decentralized demand-driven hub Journal
46,Luke Smith,R46_P13,Mr health page opportunity seem,Luke Smith; Charles Johnson; Curtis Terry; Jessica Lane,3,323,2016,Streamlined neutral function Journal
46,Luke Smith,R46_P14,Born become inside one country hard question,Luke Smith; Billy Duran; Daniel Flores; Casey Yates,3,384,2003,Distributed homogeneous workforce Journal
46,Luke Smith,R46_P15,Discussion forget former interest commercial career,Luke Smith; Patricia Blanchard; Jonathan Wilson; Jennifer Bond; Donna Richardson; Kenneth Martin; Kent Miller; Kayla Rogers; Rebecca Bradley,8,282,2015,Up-sized zero tolerance matrices Journal
46,Luke Smith,R46_P16,Health serve possible first whole realize,Luke Smith; John Kirk Jr.; Benjamin Martinez; Eric Flores; Jonathan Dominguez; Gary Bell; Brenda Novak; Malik Robertson; Chelsea Vargas,8,481,2003,Grass-roots systemic success Journal
46,Luke Smith,R46_P17,Yeah cost partner culture office imagine,Luke Smith; Ronald Murray; Joseph Stewart; Kenneth Nelson; Lauren Moon,4,489,1982,Multi-layered local project Journal
46,Luke Smith,R46_P18,Administration certainly main security,Luke Smith; Marcus Bailey; Brittany Mccall; Samuel Marsh; Sherry Mendez; Teresa May; Christopher Abbott; Danielle West; Christine Parker; Madison Garcia,9,289,2002,Future-proofed bi-directional approach Journal
46,Luke Smith,R46_P19,Talk federal hard,Luke Smith; Brandon Levine; Ryan Koch; Cody Collier; Frank Butler; Thomas Ali; Gloria King; Michael Jackson; Laura Smith,8,180,2002,Inverse transitional methodology Journal
46,Luke Smith,R46_P20,Project director his tree truth,Luke Smith; Tammy Whitaker; Michael Le; Anthony Moody; Kelly Galloway; Kenneth Ayala,5,364,2010,Configurable web-enabled intranet Journal
46,Luke Smith,R46_P21,Card employee several be concern tree,Luke Smith; Mark Freeman; James Williams; Jessica Beck; Nicholas Solomon; Corey Craig,5,253,2020,Customer-focused hybrid core Journal
46,Luke Smith,R46_P22,Cell future wait,Luke Smith; Andrea Conway; Sherry Arnold; Lonnie Estrada; Kimberly Knight; Cassandra Pratt; Carolyn Olsen; Maria Garcia; Kelly Lozano; Brian Rodriguez,9,312,1985,Optional hybrid hierarchy Journal
46,Luke Smith,R46_P23,Spring which really however officer,Luke Smith; Bryan Bond; Christian Bullock; Samantha Johnson; Steve Hernandez; Katie Turner; Luke Gordon; Jeanne Cox; Benjamin Daniels; Todd Greene,9,356,1989,Adaptive web-enabled artificial intelligence Journal
46,Luke Smith,R46_P24,Thought force parent big indicate what really,Luke Smith; Whitney Levy; Chase Wilson; Stephanie Garcia; Ernest Taylor; James Rich; Stacy Young; David Espinoza,7,167,2018,Fully-configurable stable info-mediaries Journal
46,Luke Smith,R46_P25,Thing theory TV house,Luke Smith; Karen Miller; Richard Smith; David Conley; Dawn Allen; Robert Li,5,421,1999,Advanced upward-trending capacity Journal
46,Luke Smith,R46_P26,Significant people rule prepare play,Luke Smith; Leslie Nichols; Susan Simmons; John Williams,3,2,2001,Phased human-resource algorithm Journal
47,Sherri Grimes,R47_P1,Large full soldier,Sherri Grimes; Amber Allen; Andrew Moody; Alicia Nunez; Linda Roy; Brianna Yates; Brenda Hill,6,475,2015,Pre-emptive client-driven archive Journal
47,Sherri Grimes,R47_P2,Join specific writer or,Sherri Grimes; Christopher Bolton; Nathaniel Molina; Lauren Flores; Justin Garcia; Rebecca Dixon; James Lee; Carol Flowers; Jessica Smith; Nancy Williams,9,238,1984,Optional grid-enabled frame Journal
47,Sherri Grimes,R47_P3,Tough lead practice bad pass happen,Sherri Grimes; Robert Swanson; Leslie Craig; Emma Edwards; Anthony Smith; Scott Rios; James Cummings MD; Elizabeth Campbell,7,396,2009,Enterprise-wide solution-oriented emulation Journal
47,Sherri Grimes,R47_P4,Cup get help indicate when by,Sherri Grimes; Joshua Smith; Kenneth Jones; Dawn Ramirez; Paul Martin; Gary Garcia,5,189,2004,Re-engineered reciprocal pricing structure Journal
47,Sherri Grimes,R47_P5,Partner go benefit including process great,Sherri Grimes; Michele Rangel; Jason Parker; David Valencia,3,111,1993,Ergonomic tertiary alliance Journal
47,Sherri Grimes,R47_P6,Safe act table safe edge make,Sherri Grimes; Thomas Thomas II; Sean Tucker; Rhonda Oneill; Wendy Gonzalez; Meghan Robinson; Ashley Black,6,184,2015,Optimized discrete initiative Journal
47,Sherri Grimes,R47_P7,Staff president now discover war film kitchen,Sherri Grimes; Nicole Wiley; Barbara Leach; Evan Perkins; Scott Vance; Brandon Obrien; Cynthia Travis; Whitney Gordon; David Velasquez,8,38,2001,Organic asymmetric utilization Journal
47,Sherri Grimes,R47_P8,Thousand pull ago dog until believe song during,Sherri Grimes; Joshua Watson; Andrew Williams; Christian Jones; Joshua West; Dennis Henderson; Joshua Patel,6,212,2000,Upgradable zero administration groupware Journal
48,Mackenzie White,R48_P1,Off technology take decide campaign again could find,Mackenzie White; Daniel Harris MD; Jason Jones; Alex Bridges; Adam Carter; David Richardson; Jordan Turner; John Daugherty,7,240,2010,Cloned executive open system Journal
48,Mackenzie White,R48_P2,Quickly others ground sense,Mackenzie White; Julie Sandoval DDS; Angela Mills,2,425,1988,Digitized systemic software Journal
48,Mackenzie White,R48_P3,Wait never resource town statement make live,Mackenzie White; Jacob Brown; Julie Jones; Lisa Miller; Courtney Bryant; Caitlyn Ramirez; Andrew Ward,6,464,1996,Virtual radical task-force Journal
48,Mackenzie White,R48_P4,School improve member stock population so,Mackenzie White; Courtney Wilson; Melissa Jimenez; Mary Maxwell; Amanda Sims,4,323,2004,Reverse-engineered eco-centric functionalities Journal
48,Mackenzie White,R48_P5,Member people trade black worker point,Mackenzie White; James Taylor; Douglas Torres; David White; Justin King; Crystal Edwards,5,122,2016,Customer-focused grid-enabled matrix Journal
48,Mackenzie White,R48_P6,With school white avoid,Mackenzie White; Jimmy Douglas,1,101,1980,Operative logistical access Journal
48,Mackenzie White,R48_P7,Grow power rest sense purpose environment,Mackenzie White; Sarah Cole; Kelli Watkins; John Ponce; Kimberly Lang; Carmen Baldwin; Vanessa Lloyd; Amanda Williams; Meghan Smith; Randy Montgomery,9,190,2015,Enterprise-wide analyzing software Journal
48,Mackenzie White,R48_P8,Site far black kitchen,Mackenzie White; Kimberly Smith; Anna Barron; Victoria Arnold; Brad Barnes; Brittany Hamilton; Elizabeth Valentine; Mr. Justin Perry Jr.; Veronica Shaw; Adam Allen,9,80,2003,Proactive well-modulated architecture Journal
48,Mackenzie White,R48_P9,Realize process difference,Mackenzie White; Julie Taylor; Mary Barton; Lisa Webb; Lindsay Cochran; Daniel Parsons; Tyler Palmer; John Weber; Kathryn Lawrence,8,193,1994,Inverse maximized time-frame Journal
