researcher_id,author_name,paper_id,title,authors,co_authors_count,citations,year,journal
21,Tiffany Frederick,R21_P12,Yard believe whether teach single result,Tiffany Frederick; Alejandra Buck; Alexander Cochran; Felicia Perry,3,65,2016,Profit-focused modular task-force Journal
21,Tiffany Frederick,R21_P13,Under each help line reflect enough exist,Tiffany Frederick; Barbara Hardy,1,260,2019,Reactive clear-thinking policy Journal
21,Tiffany Frederick,R21_P14,Hot particular generation though baby,Tiffany Frederick; Rhonda Pitts; Laura Rodriguez; David Moreno; Alexander Taylor; Chloe Briggs MD; Lance Hernandez; Donald Morgan; David Johnson,8,459,2015,Operative 24hour process improvement Journal
21,Tiffany Frederick,R21_P15,Mind imagine section stop,Tiffany Frederick; Paula Rogers; James Graham DDS; Michael Wilson; Richard Smith; Corey Mooney; Christina Myers; Anita Pitts,7,300,2010,User-friendly upward-trending frame Journal
21,Tiffany Frederick,R21_P16,Authority wait defense well should effect future,Tiffany Frederick; Jeffrey Pierce; Brian Sims; Dr. Mathew Thomas,3,394,1993,Assimilated human-resource collaboration Journal
21,Tiffany Frederick,R21_P17,See American drug to above,Tiffany Frederick; Jillian Lee; John Estrada; Stephanie Taylor; David Brooks; Amy Estrada; Michael Obrien; Jacob Cunningham; Regina Mitchell; Alan Cowan,9,79,1980,Expanded multi-tasking firmware Journal
21,Tiffany Frederick,R21_P18,Idea our of wall,Tiffany Frederick; Marcus Morton; Mary Greer; Olivia Reese; Paige Dickerson,4,132,1987,Function-based optimal workforce Journal
21,Tiffany Frederick,R21_P19,Movement hand himself weight,Tiffany Frederick; Gary Garcia,1,170,1999,Cross-group multi-state frame Journal
21,Tiffany Frederick,R21_P20,Notice society task well three,Tiffany Frederick; Ryan Roman; Richard Parsons; Justin Yu; Marcus Johnson; Brittney Bowman; Jason Snow; Carrie Lewis; Wendy Perez; Erika Bates,9,283,2022,Ameliorated zero administration middleware Journal
21,Tiffany Frederick,R21_P21,Catch today serious structure wonder stock today,Tiffany Frederick; Stacy Wilson; Michael Bishop; Joshua Sweeney; Kevin Howard; Jessica Adams,5,420,1991,Multi-lateral solution-oriented encryption Journal
21,Tiffany Frederick,R21_P22,General piece type describe no speak,Tiffany Frederick; Ronald Khan,1,164,2023,Reactive homogeneous orchestration Journal
21,Tiffany Frederick,R21_P23,Finish front under build successful since human,Tiffany Frederick; Kevin Mejia; Denise Nolan; Sandra Martin; April Contreras; Lindsay Solomon; Zachary Wilson,6,311,2023,Visionary content-based workforce Journal
21,Tiffany Frederick,R21_P24,Avoid property sport friend wide,Tiffany Frederick; Amber Jones; Lisa Ramirez; Lawrence Hodge; Jesse Ayala,4,250,1993,Virtual human-resource middleware Journal
21,Tiffany Frederick,R21_P25,We politics phone anyone happy point establish time,Tiffany Frederick; Kyle Myers; Tommy Mcclure; Pamela Jenkins; Chad Smith; Nichole Vasquez; Kara Cruz; Christopher Lyons; Patricia Baker; Joseph Ferguson,9,129,2016,Self-enabling multi-state customer loyalty Journal
21,Tiffany Frederick,R21_P26,Law become car use group,Tiffany Frederick; Christina Moon,1,19,2014,Cloned content-based customer loyalty Journal
21,Tiffany Frederick,R21_P27,Until less daughter you traditional question bad,Tiffany Frederick; James Robinson; Roger Petty; John Payne; Jamie Lee; Steven Gardner,5,197,1984,Open-architected bi-directional Local Area Network Journal
21,Tiffany Frederick,R21_P28,Rise collection often,Tiffany Frederick; Sean Carter,1,160,1993,Integrated empowering parallelism Journal
21,Tiffany Frederick,R21_P29,Expect apply later radio story,Tiffany Frederick; Joseph Pennington; Natalie Porter; Suzanne Jones; Margaret Humphrey,4,11,2003,Balanced bandwidth-monitored Internet solution Journal
21,Tiffany Frederick,R21_P30,Pick end us information,Tiffany Frederick; Gina Gallegos; Melissa Kim,2,250,2004,Reverse-engineered national contingency Journal
21,Tiffany Frederick,R21_P31,Drug boy middle myself you impact full,Tiffany Frederick; Joanna Rodgers; Michael Stephens DDS; Timothy Wilson; Antonio Valencia; Steven Holmes PhD; Alexis Duran; Charles Hopkins; Danny Bailey; Angelica Long,9,305,2018,Virtual interactive emulation Journal
21,Tiffany Frederick,R21_P32,Much language bit enter notice run,Tiffany Frederick; Patricia Thompson; Mrs. Laura Novak; Tina Grant; Melanie Young; Kimberly Logan; Tiffany Martinez; Sarah Yates; Melissa Hall,8,222,2022,Switchable high-level access Journal
21,Tiffany Frederick,R21_P33,Respond economy why possible fear paper suffer particular,Tiffany Frederick; Andrea Miller; Mark Romero; Nicole Johnson; Anna Mclean; Joshua West; Joshua Stanton; Timothy Hayes,7,177,2023,Quality-focused intermediate success Journal
21,Tiffany Frederick,R21_P34,As physical wind manager mother his change perhaps,Tiffany Frederick; Katie Higgins; Roy Flores; Kathleen Brady; Kim Maldonado,4,293,2002,Multi-tiered zero-defect archive Journal
21,Tiffany Frederick,R21_P35,Radio society happy receive,Tiffany Frederick; Mary Parrish; Jeanette Luna; Jesus Johnson; Carol Yoder,4,383,1995,Adaptive impactful project Journal
21,Tiffany Frederick,R21_P36,System environmental consumer model leave hour,Tiffany Frederick; Ronald Carr; David Lynn; Nancy Bradford; Sandra Walker; Kimberly Valenzuela; Ashley Sullivan; Michael Moon,7,433,1987,Enhanced zero-defect synergy Journal
21,Tiffany Frederick,R21_P37,Reveal usually concern war home why,Tiffany Frederick; Tracy Walker; Gwendolyn Franklin; Ashley Dalton; Ashley Page; Alexander Brewer,5,497,1980,Enterprise-wide national task-force Journal
21,Tiffany Frederick,R21_P38,Food particular series significant expert energy account,Tiffany Frederick; Marcus Rich; Samantha Jones; Suzanne George; Curtis Whitaker; David Leon; Jackson Foster,6,263,1984,Programmable empowering info-mediaries Journal
21,Tiffany Frederick,R21_P39,Blue still dark describe community people Democrat,Tiffany Frederick; Nicholas Sampson; Robert West; Alan Oliver; Brittany Lin; Diane Carrillo; Ricardo Thompson,6,494,2013,Cross-group fresh-thinking frame Journal
21,Tiffany Frederick,R21_P40,Receive model no painting,Tiffany Frederick; Norma Smith; David Palmer; Pamela Morales; Taylor Grant; Patty Butler; Sharon Silva; Paul Ryan,7,192,2005,Networked reciprocal moderator Journal
21,Tiffany Frederick,R21_P41,Manage full front scientist,Tiffany Frederick; Kimberly Morgan; Tracey Hogan,2,426,1997,Grass-roots exuding concept Journal
21,Tiffany Frederick,R21_P42,Explain maybe fight pass budget bar really world,Tiffany Frederick; Timothy Smith; Christopher Parker; Laurie Johns; David Day; Wendy Wilson; Evan Clark; John Boyd; Jessica Rojas,8,144,2019,Intuitive zero tolerance structure Journal
21,Tiffany Frederick,R21_P43,Expect mind pay history people,Tiffany Frederick; Brianna Mccarty; Taylor Henderson; Rachel Ball; Jason Burgess; Ryan Mercer; Tamara Roberts; Andrea Robinson; Michelle Morton,8,368,2004,Synergized bandwidth-monitored forecast Journal
22,Casey Huff,R22_P1,These population phone perhaps,Casey Huff; Oscar Mcclure,1,288,1998,De-engineered dedicated portal Journal
22,Casey Huff,R22_P2,Majority daughter need generation mouth,Casey Huff; Jennifer Mccarthy; Cassandra White; John Green; Kristina Baker; Christopher Duncan,5,286,1984,Programmable dynamic instruction set Journal
22,Casey Huff,R22_P3,Bed staff talk score him price drop bill,Casey Huff; Sean Higgins; Maria Thompson,2,360,1985,Automated fresh-thinking circuit Journal
22,Casey Huff,R22_P4,Kitchen response describe north old,Casey Huff; Ryan Johnson; Christopher Moses; Cindy Jenkins; Brian Simmons; Scott Jones; Juan Thomas; Erika Cox; Rachel Foley; Erica Case,9,62,2012,Persevering systemic data-warehouse Journal
22,Casey Huff,R22_P5,Right leg season manage claim hotel east,Casey Huff; Gary Grimes; Tiffany Jimenez; Audrey Barry; Sarah Aguilar; Kenneth Alexander; Gary Estrada; Olivia Lozano; Cindy Zimmerman; Brenda Bean,9,168,1992,Future-proofed intangible capability Journal
22,Casey Huff,R22_P6,Agreement push will care,Casey Huff; Nicholas Barber; Colin Johnson; Philip Burns; Melissa Owens; Sharon Gonzales,5,72,1992,Programmable dynamic capacity Journal
22,Casey Huff,R22_P7,Project group door movement under sometimes,Casey Huff; Rachel Cervantes; Alan Spence; James Miller; Rebecca Flores; Gregory Wiggins; Shelby Duncan; Anna Maxwell; Carol Mcintosh; Nicole Beck,9,158,1990,Synergized demand-driven solution Journal
22,Casey Huff,R22_P8,Everyone test memory arm statement treatment office,Casey Huff; Angela Mcdaniel DDS; Ashley Sanders,2,323,2017,Cross-group exuding customer loyalty Journal
23,Monique Wilson,R23_P1,Improve sell cause boy sign pull break,Monique Wilson; Brian Gentry; Luis Johnson; Grant Newton,3,101,1985,Diverse bottom-line software Journal
23,Monique Wilson,R23_P2,Cup performance role already occur,Monique Wilson; George Herrera; Jordan Mcdowell,2,481,1992,Progressive well-modulated intranet Journal
23,Monique Wilson,R23_P3,Change size computer bed,Monique Wilson; Justin Foster; Tammy Heath; Erin Taylor; Jaime Smith; Cheryl Bradford; Hannah James PhD; Nancy Smith,7,488,1998,Innovative zero-defect model Journal
23,Monique Wilson,R23_P4,Other campaign reason market admit best why,Monique Wilson; Donald Coleman,1,364,2003,Extended transitional secured line Journal
23,Monique Wilson,R23_P5,Happen film under deep agree walk thousand,Monique Wilson; Allison Branch; Jenny Cox; David Simpson; Kyle Brown; Tracey Reynolds; Alison Perez; Douglas Santos,7,309,2004,Multi-channeled neutral Graphic Interface Journal
23,Monique Wilson,R23_P6,Well citizen these place account,Monique Wilson; Sharon Johnson,1,212,1991,Customer-focused global functionalities Journal
23,Monique Wilson,R23_P7,Guy toward what north shoulder later institution skin,Monique Wilson; Jacqueline Lawrence; Hannah Mitchell; Theresa King; Breanna Patrick; Aaron Williams,5,198,1998,Centralized bottom-line adapter Journal
23,Monique Wilson,R23_P8,But debate south say include discover last,Monique Wilson; Tony Burns; Andrew Smith; Nicholas Diaz; Kevin Oneill; Grant Brown; Jordan Ortiz; Anthony Marquez; Wayne Hess; Wayne Finley,9,315,2012,Centralized zero administration capability Journal
24,Curtis Morales Jr.,R24_P1,Itself give teacher put land region other,Curtis Morales Jr.; Daniel Hoffman MD; Dr. Paula Lawson MD; Teresa Weeks,3,496,2023,Exclusive 4thgeneration adapter Journal
24,Curtis Morales Jr.,R24_P2,Bad one modern store,Curtis Morales Jr.; Karen Johnson; Jennifer Coleman; Gary Lawrence,3,101,1987,Optional hybrid Internet solution Journal
24,Curtis Morales Jr.,R24_P3,Anything open project buy,Curtis Morales Jr.; Alejandro Rios; Kimberly David,2,109,1988,Versatile asymmetric utilization Journal
24,Curtis Morales Jr.,R24_P4,Recent off fire property remain first common eight,Curtis Morales Jr.; Amanda Lawrence; Linda Crawford; Rachel Rice; Danny Brown MD; Bryan Perry,5,2,2005,Cloned transitional open system Journal
24,Curtis Morales Jr.,R24_P5,Bill traditional western chance machine,Curtis Morales Jr.; Karina Duncan; Ronald Gill,2,327,1985,Robust next generation synergy Journal
24,Curtis Morales Jr.,R24_P6,Prove organization old treatment yet land address,Curtis Morales Jr.; Susan Martin; William Keller; John Robertson; Kimberly Jackson; Anthony Moore,5,411,2008,Optional contextually-based database Journal
24,Curtis Morales Jr.,R24_P7,Sort physical believe us view want son dog,Curtis Morales Jr.; Nicole Duncan; Stacey Deleon; Charles Rodriguez; Tonya Simon; Lori Oconnell; Katie Ochoa; Tracy Reilly; Elizabeth Taylor; Jocelyn Beard,9,153,1991,Synchronized stable algorithm Journal
24,Curtis Morales Jr.,R24_P8,Number key medical join activity,Curtis Morales Jr.; Robert Green; John Kennedy,2,132,2016,Multi-channeled multi-state migration Journal
24,Curtis Morales Jr.,R24_P9,Nor federal idea share property various,Curtis Morales Jr.; Kathryn Montoya; Christopher Santiago; Kathy Ford; Lauren Duarte,4,462,1994,Cross-group contextually-based core Journal
24,Curtis Morales Jr.,R24_P10,Environment open director,Curtis Morales Jr.; Tanner Davis; Ashley Simmons; Juan Wright MD; Rhonda Tran; Nathan Gomez; Julia Yates; Meagan Sanders,7,42,1985,Polarized static productivity Journal
24,Curtis Morales Jr.,R24_P11,Unit reduce executive particular himself eat enter partner,Curtis Morales Jr.; Jesse Edwards; Adam Hoffman,2,301,2023,Implemented scalable analyzer Journal
24,Curtis Morales Jr.,R24_P12,Wonder green set stay,Curtis Morales Jr.; Joshua Martinez; Laura Clarke; Joseph Patel; Lisa Beard; David Mendoza,5,378,2002,Customer-focused human-resource circuit Journal
24,Curtis Morales Jr.,R24_P13,Office interesting perhaps as feel Democrat stop only,Curtis Morales Jr.; Misty Howard; Linda Briggs; Dr. Michelle Rodriguez MD; Stephanie Peterson; Mrs. Dawn Hawkins; Gary Greer; Christopher Knox,7,106,1995,Versatile multi-tasking intranet Journal
24,Curtis Morales Jr.,R24_P14,Certain buy best fish all cover eye,Curtis Morales Jr.; Keith Morales; Perry Washington; Nicole Barton; David Medina; Lydia Payne,5,302,1994,Grass-roots web-enabled framework Journal
24,Curtis Morales Jr.,R24_P15,Street certainly even kitchen including summer bit,Curtis Morales Jr.; Gabriel Lopez; James Baker; Matthew Williamson; Melissa Perkins,4,280,1990,Upgradable 24hour initiative Journal
24,Curtis Morales Jr.,R24_P16,Find medical note read term force,Curtis Morales Jr.; Veronica Lara; Caleb Taylor; Catherine Kirk; Wendy Sanchez,4,50,2000,Total regional neural-net Journal
24,Curtis Morales Jr.,R24_P17,Box listen institution rock dinner other,Curtis Morales Jr.; Kristi Foster; David Daugherty; Ariel Riley; Kyle Gray; Alexander Douglas; Renee Evans,6,140,1998,Multi-tiered system-worthy analyzer Journal
24,Curtis Morales Jr.,R24_P18,Fall heavy heart,Curtis Morales Jr.; Rachel Yang; Jessica Jimenez; Richard Baker; Richard Collins,4,289,2006,Reduced eco-centric conglomeration Journal
24,Curtis Morales Jr.,R24_P19,Future throughout number site final five,Curtis Morales Jr.; Richard Trujillo; Carlos Vincent; Robert Liu,3,156,1987,Optimized high-level matrix Journal
24,Curtis Morales Jr.,R24_P20,From eye board plan page get,Curtis Morales Jr.; Alexa Frederick; Scott Wilson; Christopher Gill; Vincent Mendoza,4,143,2009,De-engineered scalable contingency Journal
24,Curtis Morales Jr.,R24_P21,Care firm attack agree bad exactly,Curtis Morales Jr.; Mrs. Susan Christian; Danielle Robles,2,145,1992,Switchable methodical function Journal
24,Curtis Morales Jr.,R24_P22,Set woman address,Curtis Morales Jr.; Jose Foster; Wendy Anderson; Carrie Larson; Jill Floyd; Robert Griffin; Jennifer Baker MD; Angela Cross; Amy Rice; Peter Mendoza,9,131,2009,Sharable human-resource approach Journal
24,Curtis Morales Jr.,R24_P23,Role term mother leave go standard collection work,Curtis Morales Jr.; Carrie Anderson; Melissa Hall; David Robles; Debra Johnson; Dawn Delgado; John Singh; Sarah Jones,7,458,2010,Focused intermediate hardware Journal
24,Curtis Morales Jr.,R24_P24,Experience Mr she room man vote safe,Curtis Morales Jr.; Mrs. Stephanie Sanders; Matthew Newman; Carol Jackson; Ronnie Ryan; Sally Hurst; Adam Daniels; Andrea Bowers,7,107,1992,Devolved content-based collaboration Journal
24,Curtis Morales Jr.,R24_P25,Resource create hit yes without foot,Curtis Morales Jr.; Sandra Adams; Erin Perez; Andrew Mccall; Madison Garcia; Shane Alexander; Kayla Jones; William Ramirez,7,158,2021,Fully-configurable 6thgeneration extranet Journal
24,Curtis Morales Jr.,R24_P26,Energy apply mother standard these,Curtis Morales Jr.; Karen Harvey; Richard Rodriguez; Marilyn Lozano; Erica Schneider; Joshua Horne; Dawn Ryan; Marcus Riley; Kelsey Frank DVM,8,444,2015,Function-based static hierarchy Journal
24,Curtis Morales Jr.,R24_P27,Fill world loss reflect,Curtis Morales Jr.; Ashley Franco; Dawn Hall; Shannon Downs; Tracey Page,4,83,1986,Virtual system-worthy policy Journal
24,Curtis Morales Jr.,R24_P28,Story possible or clear dog,Curtis Morales Jr.; Ashley Daugherty,1,309,2023,Enhanced encompassing capacity Journal
24,Curtis Morales Jr.,R24_P29,Air turn church thing decide common term,Curtis Morales Jr.; Michelle Hawkins; Charles Williams; Cody Thompson; Arthur Boyd; James Williams; Ryan Carlson; Tamara Rhodes,7,375,2001,Stand-alone stable neural-net Journal
24,Curtis Morales Jr.,R24_P30,Natural stand country,Curtis Morales Jr.; Brandon Brown; Stephanie Roberts; David Harding; Nicole Hartman; Richard Miranda,5,117,2001,Universal human-resource capability Journal
24,Curtis Morales Jr.,R24_P31,Fire impact word first put,Curtis Morales Jr.; Aaron Quinn; Joyce Walton DVM; Robert Ramirez; Patrick Gray; Erin Leach; Jeffrey Prince; Derrick Jones; Jenna Watson; Michelle Padilla,9,219,2005,Reactive secondary challenge Journal
24,Curtis Morales Jr.,R24_P32,Must beyond pass two option significant light,Curtis Morales Jr.; Alexis Mejia; Jessica Kelley; Charles Ferguson; Lisa Moore; Rachel Rice; Kristin Meyer; Bailey Rice; Margaret Harrington,8,8,2021,Face-to-face executive ability Journal
24,Curtis Morales Jr.,R24_P33,Sort investment guy such notice to,Curtis Morales Jr.; Kurt Martinez; Brandi Ibarra; Heather Sweeney; Laura Guerra; Adrian Levine; Abigail Acevedo; Isabella Taylor; Joel Rogers,8,71,1995,Compatible high-level algorithm Journal
24,Curtis Morales Jr.,R24_P34,Lead relationship provide case father own six,Curtis Morales Jr.; Michael Davenport; Diana Franklin; Teresa Graham; Charles Hahn; Kevin Cole,5,48,1983,Intuitive bottom-line knowledgebase Journal
24,Curtis Morales Jr.,R24_P35,Entire car statement get family main,Curtis Morales Jr.; Emma Chan; Ryan Thomas; Holly Rivas; Alicia Navarro; James Schaefer; Jennifer Sampson; Daniel Taylor; Julie Thompson,8,49,1998,Triple-buffered empowering success Journal
24,Curtis Morales Jr.,R24_P36,Thought those evidence around magazine present,Curtis Morales Jr.; Kellie Martin; Jesse Davis; Andrea David DDS; Patricia Smith; Richard Hahn; Nicole Brown; Jacob Smith,7,99,1989,Diverse next generation pricing structure Journal
25,John Aguirre,R25_P1,Into section analysis guy,John Aguirre; Shannon Alexander; Brandy Williams; Robert Wheeler,3,145,2015,Switchable background functionalities Journal
25,John Aguirre,R25_P2,Eight red write beautiful mean size no,John Aguirre; Edward Cochran,1,457,1984,Synergized 24/7 ability Journal
25,John Aguirre,R25_P3,Including new degree tax general organization everything,John Aguirre; Brian Huff,1,174,2014,Digitized non-volatile model Journal
25,John Aguirre,R25_P4,Understand within dark financial Mrs degree side,John Aguirre; Amanda Cook; Raymond Beck,2,107,2012,Cross-group regional utilization Journal
25,John Aguirre,R25_P5,Attention throughout degree think,John Aguirre; Heather Scott; Samantha Rogers; Jennifer Brown; Veronica Graham; Jo Chapman,5,118,1996,Open-architected directional software Journal
25,John Aguirre,R25_P6,Us me natural whose fish,John Aguirre; Thomas Salinas; Sarah Sullivan; Anthony Cook; Jeremy Hill; Ian Harvey,5,149,1994,Face-to-face transitional extranet Journal
25,John Aguirre,R25_P7,City north role act alone view,John Aguirre; Erika Williams; Emily Johnson; Ashley Hall DVM; Julie Romero MD; Melissa Thomas; Michele Wallace; Michael Thompson,7,418,2011,Multi-channeled attitude-oriented hierarchy Journal
25,John Aguirre,R25_P8,He doctor stage usually recognize bar computer a,John Aguirre; Chad Kim; Riley Knight; Amy Moore; Robert Ellison; Brian Lewis; Catherine Johns; Mary Parks; Mark Williamson; Douglas Blanchard,9,10,1993,Sharable 4thgeneration initiative Journal
25,John Aguirre,R25_P9,Region suddenly less nearly us remain,John Aguirre; Holly Johnson; Paul Jones; James Bernard; Tracy Mejia; Michael Riley; Gregory Pace; Jessica Hunter; Paige Brown; Lori Browning,9,76,2004,Proactive bandwidth-monitored task-force Journal
25,John Aguirre,R25_P10,Pattern company nation get seek training rather future,John Aguirre; James Johnson; John Shepard; Alec Duncan,3,257,1986,Face-to-face solution-oriented Graphical User Interface Journal
25,John Aguirre,R25_P11,Hit keep enjoy sing time you may,John Aguirre; Beth Preston; Cory Charles,2,84,1982,Reactive analyzing archive Journal
25,John Aguirre,R25_P12,Technology after hotel learn serve suffer,John Aguirre; Adam Martin; Adam Snyder; Mrs. Beverly Myers; Joe Scott; Lori Stanley; Peggy Robinson,6,41,2018,Integrated optimal standardization Journal
25,John Aguirre,R25_P13,Attorney say allow always,John Aguirre; Jennifer Rhodes,1,424,1990,Face-to-face fault-tolerant groupware Journal
25,John Aguirre,R25_P14,New including education add though bring himself,John Aguirre; Robert Jensen; Steven Cook; Susan Cook; Kristine Tyler; Erica Cunningham; Christopher Mclaughlin; Emily Foster; Ryan Barnes,8,486,1998,Multi-channeled dynamic ability Journal
25,John Aguirre,R25_P15,Leader government cost eight,John Aguirre; Dr. Melissa Martinez; Ashley Owen; Courtney Walton; Colin Graves; Matthew Franklin; Andrea Meadows,6,67,2021,Enhanced 24/7 solution Journal
25,John Aguirre,R25_P16,Of major above hand behind blood born,John Aguirre; Joseph Cook; Monica Gilmore; Julie Kaufman; Michael James; Michelle Christensen; Sylvia Mendoza; Melissa Hodge,7,287,2015,Progressive zero tolerance capability Journal
25,John Aguirre,R25_P17,Wall meet old tonight sound everybody which financial,John Aguirre; Brendan Palmer; Paul Martin; Juan Gilbert; Lori Roberson; Matthew Moore,5,231,2012,Cloned neutral implementation Journal
25,John Aguirre,R25_P18,Maintain everything deep capital see,John Aguirre; Ashley Fisher; Heather Morrison; Adam Martinez,3,163,1988,Function-based background focus group Journal
25,John Aguirre,R25_P19,Already debate anything view,John Aguirre; Colleen Anderson,1,135,1985,Self-enabling user-facing access Journal
25,John Aguirre,R25_P20,Sure camera then during responsibility among,John Aguirre; Bianca Davis; Anthony King; Michael Summers; Ricky Hall; Joyce Kelly; Anne Medina; Benjamin Johnson,7,424,1983,Universal leadingedge methodology Journal
25,John Aguirre,R25_P21,Radio spend within available fear tend,John Aguirre; Tony Perkins,1,268,1981,Diverse radical array Journal
25,John Aguirre,R25_P22,Enough success score,John Aguirre; Andrea Hughes; Keith Solis; Bryan Tucker; Holly Grant; Ryan Skinner,5,443,2023,Progressive didactic capability Journal
25,John Aguirre,R25_P23,Himself red upon,John Aguirre; Jose Long; Eric Mitchell; Dawn Douglas; Jeffrey Petty; Lindsey Lopez,5,26,1987,Object-based logistical system engine Journal
25,John Aguirre,R25_P24,Across positive heavy law can college,John Aguirre; Stephen Wilson; Charles Robinson; Chad Poole; Matthew Dominguez; Christian Shelton; Makayla Friedman; Katherine Downs; Lisa Singh,8,229,1982,Face-to-face non-volatile instruction set Journal
25,John Aguirre,R25_P25,Right traditional represent price number,John Aguirre; Daniel Castro; Stacy Cortez; Diane Murray,3,299,2001,Open-source client-server productivity Journal
25,John Aguirre,R25_P26,Half door early we,John Aguirre; Amanda Norris; Michael Diaz,2,325,2002,Enterprise-wide high-level secured line Journal
25,John Aguirre,R25_P27,Agreement woman environment tell sing hospital,John Aguirre; Megan Porter; Jennifer Joseph,2,171,2017,Synchronized multi-tasking methodology Journal
25,John Aguirre,R25_P28,Water guess dream have line tax,John Aguirre; Timothy Wheeler; Tonya Brown; Douglas Miller,3,208,2013,Up-sized encompassing success Journal
25,John Aguirre,R25_P29,Movement traditional of,John Aguirre; Taylor Stark; Brandon Peterson; Linda Morris; Laura Sanders,4,470,1987,Mandatory executive hub Journal
26,Catherine Castaneda,R26_P1,Carry happy response would enter,Catherine Castaneda; Timothy Mitchell; Dr. Marie Silva MD; Teresa Velasquez; Eugene Parker,4,299,1984,Front-line 24/7 knowledgebase Journal
26,Catherine Castaneda,R26_P2,Include price leader bit traditional tough air,Catherine Castaneda; Monica Simpson; Heather Jackson; Angela Blair; Thomas Hawkins; Daniel Ochoa; Nancy Thompson; Kathy Murray; Michael Zamora; Mr. Cory Hanna PhD,9,332,1995,Universal analyzing knowledge user Journal
26,Catherine Castaneda,R26_P3,In game score challenge toward leg car,Catherine Castaneda; Michael Russell; Aaron Ramirez; Ronald Buckley; Heather Hernandez; Joshua Johnson; Erika Stone; Mrs. Tammie Webb; Monica Jones; Joel Bradford,9,105,1995,Synergistic 4thgeneration solution Journal
26,Catherine Castaneda,R26_P4,Page dinner off,Catherine Castaneda; Patricia Robinson,1,11,1995,Ergonomic bottom-line interface Journal
26,Catherine Castaneda,R26_P5,Really manager clearly along business her generation remember,Catherine Castaneda; Jeanette Knox; Matthew Johnston; Kari Sanchez; James Gilbert; Shannon Vega; Brittany Hernandez; Robin Perez; Stephanie Morrison,8,395,1999,Object-based multi-tasking workforce Journal
26,Catherine Castaneda,R26_P6,Table reality stock site develop government,Catherine Castaneda; Jay Miller; Andrew Sanders; Kristen Stevens; Jasmine Jimenez; Pamela Roman; Christina Johnson; Caleb Sanders,7,2,2007,Enhanced 24hour forecast Journal
26,Catherine Castaneda,R26_P7,Throw next nice while relationship,Catherine Castaneda; Katherine Leon; Tammy Gill; Deanna Powell; Jeremy Baker; William Brandt; Dr. Brenda Martin; Alice Rodriguez; Dawn Moore,8,114,1984,Multi-channeled secondary neural-net Journal
26,Catherine Castaneda,R26_P8,Child staff yard place contain safe government,Catherine Castaneda; Clayton Beasley; Gail Watson MD; Roy Reid; Sharon Sanchez; Ashley Brown; Ricky Hill; Abigail Caldwell; Justin Torres,8,467,2023,Realigned static support Journal
26,Catherine Castaneda,R26_P9,Chance thousand author simple company produce,Catherine Castaneda; Donna Ross; Michelle Sandoval; Erik Hill; Isaiah King; Christopher Sims; Brandon Madden; Billy Miranda; Erin Nelson; Meagan Johnston,9,320,2009,Decentralized solution-oriented open architecture Journal
