researcher_id,author_name,paper_id,title,authors,co_authors_count,citations,year,journal
76,Eric Miller,R76_P4,School power return key people herself value,Eric Miller; Jessica Thompson; Cynthia Morgan; Timothy Conley; Michael Jacobson; Nancy Dunlap; Shannon White,6,441,2011,Grass-roots holistic database Journal
76,Eric Miller,R76_P5,Lawyer state property design compare,Eric Miller; Eric Schmidt; Renee Martinez; Dr. Autumn Wallace MD; Daniel Grant; Steven Collier; Becky Miller; Eric Robinson,7,452,1984,Sharable holistic initiative Journal
76,Eric Miller,R76_P6,Leader attention food range,Eric Miller; Hannah Horton; Lauren Durham; Rachel Ramirez; Patty Thompson; Nathan Webb,5,41,2011,Proactive neutral leverage Journal
76,Eric Miller,R76_P7,Current single talk involve short,Eric Miller; Kyle Thomas; Mary Stanley; Kristin Hernandez; Karen Garcia; Matthew Tyler; Kevin Callahan; Heather Serrano,7,442,1994,Seamless interactive toolset Journal
76,Eric Miller,R76_P8,Range politics you national,Eric Miller; Nancy Holmes; Denise Miller; Kenneth Harris,3,454,1998,Multi-tiered reciprocal parallelism Journal
76,Eric Miller,R76_P9,High PM my fine agreement hit,Eric Miller; Ariana Williams; Mary Smith; William Wright,3,265,1985,Visionary attitude-oriented array Journal
76,Eric Miller,R76_P10,Near term certain process,Eric Miller; Hector Davis; Amy Alexander; Rebecca Robertson; Matthew Carter; Frank Nelson; Christina Smith,6,395,1992,Focused systemic hub Journal
76,Eric Miller,R76_P11,Spring shake whom scene light fact,Eric Miller; Elaine Fisher; Samantha Reed; Daniel Morales,3,348,1982,Stand-alone explicit toolset Journal
76,Eric Miller,R76_P12,Develop size threat relationship culture forward,Eric Miller; Julie Wagner; Shaun Chavez; Ronald Cline; Nathan James; Timothy Johnston; Alicia Zuniga; Jessica Fry; Luis Watson,8,391,1999,Exclusive web-enabled conglomeration Journal
76,Eric Miller,R76_P13,Shake effort even blue remember ask,Eric Miller; Alexis Goodwin; Keith Meyer; Christine Aguilar; Amber Smith,4,174,2000,User-centric demand-driven challenge Journal
76,Eric Miller,R76_P14,Account message black place,Eric Miller; Kristen Vargas; Lauren Davidson; Keith Hunter; Connie Randall; Leroy Woods; Anne Cook; Joseph Jones; Joyce Garner,8,450,2002,Cloned neutral protocol Journal
76,Eric Miller,R76_P15,Issue keep success see call capital others,Eric Miller; Carl Holmes; Jordan Meadows; Mrs. Jessica Leon,3,15,1988,Customer-focused multimedia alliance Journal
76,Eric Miller,R76_P16,Back base pass sound too,Eric Miller; Ashley Nguyen; Rebecca Burns; Rebecca Logan; Luis Farley; Jacob Davis,5,315,1986,Configurable mobile matrix Journal
76,Eric Miller,R76_P17,Send interest similar book Democrat body,Eric Miller; Brendan Rivera; Cheyenne Jackson; Oscar Landry; David Cook; Douglas Smith; William Perry; Kathy Nguyen,7,14,2017,Programmable clear-thinking Graphic Interface Journal
76,Eric Miller,R76_P18,Into firm remember much boy,Eric Miller; Sarah Freeman; Kristin Thompson; Stephanie Whitehead; Teresa Mullen; Andrew Maxwell; Randy Peterson; Phillip Gray; Michael Perry; Lisa Gillespie,9,225,2001,Innovative secondary synergy Journal
76,Eric Miller,R76_P19,Make entire look man direction beautiful fund,Eric Miller; Robert Houston,1,407,2016,Team-oriented value-added definition Journal
76,Eric Miller,R76_P20,Tell beautiful interest since still,Eric Miller; Nicholas Madden,1,427,1989,Vision-oriented scalable encryption Journal
76,Eric Miller,R76_P21,Happen share we significant theory stand,Eric Miller; Sharon Mcclain; William Alexander; Jordan Collins; Scott Kemp; Darlene Richards; Nicole Gill; Victoria Brown; Michael Melendez,8,490,2004,Secured local instruction set Journal
76,Eric Miller,R76_P22,Friend sense consumer save box,Eric Miller; Christina Blair; Tyler Brown; Adam Sanders; Jeffrey Ward; Kathryn Adams; Katie Moran; Julie Dunn; Hannah Mason DDS; Nicholas Kelly DDS,9,305,1996,Automated regional support Journal
76,Eric Miller,R76_P23,Them beautiful true own family,Eric Miller; Sean Brown; Michael Bentley; Margaret Duncan; Alex Dalton; Miranda Fitzgerald; Casey Snyder; Jennifer Meyer; Wesley Haas; Elizabeth Smith,9,187,2015,Polarized attitude-oriented attitude Journal
76,Eric Miller,R76_P24,Art direction anyone first cause behind,Eric Miller; Christopher Navarro; Mrs. Anna Drake MD; Justin Greene; Anthony Joseph; Laura Roy; Andre Nelson; Mackenzie Bradley,7,376,2022,Focused contextually-based info-mediaries Journal
76,Eric Miller,R76_P25,Approach significant deal whatever myself huge century,Eric Miller; Joan Henry; Travis Bentley; Elijah Flores; Wendy Griffith; Mrs. Natalie Michael,5,133,2022,Versatile transitional parallelism Journal
76,Eric Miller,R76_P26,Next strong office only term,Eric Miller; Timothy Thompson; Mrs. Kelly Rivera,2,24,1992,Profound responsive core Journal
76,Eric Miller,R76_P27,Test evidence with,Eric Miller; Daniel Moran; David Henry,2,42,2007,Balanced fault-tolerant application Journal
76,Eric Miller,R76_P28,Federal plant find factor phone,Eric Miller; Jose Roach; Jennifer Kirk; Rachel Harrison; Mary Gross; Monica Nixon; Cassandra Johnson; Chad Stafford; Brandi Erickson,8,178,2006,Fully-configurable didactic archive Journal
76,Eric Miller,R76_P29,World rule make note door different,Eric Miller; Antonio Cline; Laurie Velasquez; Jennifer Schneider; Anna Sanders; Brandon Bell; Jeff Howe; Melissa Maxwell; Russell Leblanc; Jorge Horton,9,159,2019,Cross-group mission-critical throughput Journal
77,Brent Henson,R77_P1,Offer number crime really,Brent Henson; Rachel Vasquez,1,467,1983,Persistent bottom-line conglomeration Journal
77,Brent Henson,R77_P2,Program sell majority,Brent Henson; Cameron Lucas; Jessica Martin; George Ramos; Donna Gonzalez DDS; Larry Crawford; Amanda Huerta; Jessica Lynn; Elizabeth Carlson; Savannah Perry,9,301,2013,Up-sized value-added matrices Journal
77,Brent Henson,R77_P3,Prepare main even report recognize account return center,Brent Henson; Scott Powell; Matthew Clark; Wayne Rojas,3,495,2005,Stand-alone upward-trending framework Journal
77,Brent Henson,R77_P4,Foreign relate today thought Democrat,Brent Henson; Debbie Ashley; Albert Wagner; Chris Reed; Alec Jones; James Goodwin; Jacqueline Hodges,6,391,1995,Pre-emptive national hub Journal
77,Brent Henson,R77_P5,Whose positive kitchen better show character,Brent Henson; Jennifer Thomas; Katherine Patterson; Justin Trujillo; Amy Nixon; Charles Stewart; Michelle Rhodes; Brian Stevens,7,279,2009,Re-engineered even-keeled functionalities Journal
77,Brent Henson,R77_P6,Study partner owner price series smile difference somebody,Brent Henson; Danielle Gonzalez; Jeremy Jordan; Kristen Hogan; Rachel Hernandez; Tina Clark,5,428,2004,Reverse-engineered disintermediate policy Journal
77,Brent Henson,R77_P7,Treat her Congress center,Brent Henson; John Clayton; Michelle Gilbert; William Hall; Brandi Riley; Jamie Black; Linda Johnson,6,147,1997,Up-sized intermediate monitoring Journal
77,Brent Henson,R77_P8,Organization study pattern go,Brent Henson; Julie Bright; Matthew Hamilton,2,366,1981,Exclusive demand-driven frame Journal
77,Brent Henson,R77_P9,Identify lead wonder southern Mrs including kitchen,Brent Henson; Meredith Olson; Andrea Lynch; Kenneth Baker; Travis Andrews; Claudia Ward; Diana Barnett; David Hughes,7,457,1991,Public-key background approach Journal
77,Brent Henson,R77_P10,Charge worker realize marriage hope,Brent Henson; Joshua Chan; Joshua Ortiz,2,494,1990,Centralized tertiary encoding Journal
77,Brent Henson,R77_P11,Oil again draw hair,Brent Henson; Dennis Powell; Juan Alvarez; James Lyons,3,146,2018,Object-based attitude-oriented data-warehouse Journal
77,Brent Henson,R77_P12,Cause up religious such meet Republican great,Brent Henson; Rebecca Johnson; Leah Dixon; Michael Graves; Michael Adams; Virginia Vaughn; Amy Adams,6,308,2023,Inverse 5thgeneration access Journal
77,Brent Henson,R77_P13,Section general parent hear difficult expert some,Brent Henson; James Carter; Ariel Brown; Dr. Larry Wallace Jr.; Michael Parker; Monica Miller; Taylor Young MD; Adam Stevens; Anthony Bradford; Renee Terrell,9,215,1980,Assimilated fault-tolerant middleware Journal
77,Brent Henson,R77_P14,Really during Mr although five edge,Brent Henson; Julian Banks; Autumn Graham; Andrea Gill; Kathleen Brennan; James Trevino; Melinda Tapia; Stephen Reed,7,50,2001,Seamless methodical task-force Journal
77,Brent Henson,R77_P15,Ten term eight green,Brent Henson; Clayton White; Patrick Herrera; Diana Miller; Patricia Andrews; Susan Morales; Christine Williams; Emily Silva; Amanda Smith,8,150,1998,Re-contextualized directional paradigm Journal
77,Brent Henson,R77_P16,Our remain actually issue stage in,Brent Henson; Richard Morton; Kari Williams; Maria Brown; Vicki Mcdaniel; Lindsay Wall; Donald Anderson; Zachary Stone,7,337,2007,User-centric stable service-desk Journal
77,Brent Henson,R77_P17,However measure which doctor sit cost expert,Brent Henson; Benjamin Howard,1,347,1998,Robust web-enabled paradigm Journal
77,Brent Henson,R77_P18,Very season number change impact enjoy role,Brent Henson; Zachary Bradley; Louis Arnold; Denise Ali; Dana Acevedo,4,27,2016,Inverse human-resource application Journal
77,Brent Henson,R77_P19,Attorney side toward political walk reach head,Brent Henson; Elizabeth Kennedy; James Walker; Tammy Williams,3,409,2013,Optimized heuristic function Journal
77,Brent Henson,R77_P20,Possible final personal the guess teacher catch threat,Brent Henson; Peggy Walker; Jason Fuller; Jessica Brown,3,126,2019,Multi-layered hybrid ability Journal
77,Brent Henson,R77_P21,Again memory guess head leader form Mrs off,Brent Henson; Karen Lyons; Brendan Guzman; Mr. Christian Bradley; Michele Nguyen; Michael Wang; Tanya Hughes,6,79,1992,Multi-lateral 4thgeneration hardware Journal
77,Brent Henson,R77_P22,Catch institution site,Brent Henson; Terry Hammond MD; Matthew Jackson; Robert Carpenter; Matthew Gill; John Lee; Kristen Patton; Rachel Smith,7,125,2001,Ameliorated optimizing capability Journal
77,Brent Henson,R77_P23,Have class make TV somebody,Brent Henson; James Mcbride; Catherine Ramos; Regina Butler,3,15,1987,Public-key dynamic attitude Journal
77,Brent Henson,R77_P24,Set alone probably four network all,Brent Henson; Susan Johnston; Spencer Molina; Erin Collier; Amy Davis; Daniel Stephens; Regina Cook; Kristin Williams,7,235,2001,Open-architected neutral infrastructure Journal
77,Brent Henson,R77_P25,People rich blood example most,Brent Henson; Renee Bailey; Madison Cobb; Edward Patterson; Kyle Wheeler; Jesse Johnson; Jennifer Cox; Susan Myers; Heidi Gates,8,84,2000,Polarized logistical process improvement Journal
77,Brent Henson,R77_P26,Since plant human marriage sort,Brent Henson; Isaac Oliver; Kyle Jackson; Douglas Ayala; Steven Hoffman; Catherine James; Katrina Collins; Kelsey Myers; Stephen Dunn; Daniel Rogers,9,408,1980,Intuitive static groupware Journal
77,Brent Henson,R77_P27,Customer probably bank current quality,Brent Henson; Jeffrey Ochoa; Stephanie Martin; Karen Phillips; Ronald Kramer; Paul Perez; Renee Rodriguez; Angela Hale,7,133,2002,Centralized stable hub Journal
77,Brent Henson,R77_P28,Get national program mission,Brent Henson; Robin Stanley; Mark Potter; Melanie Torres; Elizabeth Hill; Christie Woods; Jennifer Reese; Glenn Washington,7,426,2011,Open-source next generation complexity Journal
77,Brent Henson,R77_P29,Medical drug eye change,Brent Henson; Jonathan Harper; Erik Richards,2,157,2002,Re-engineered analyzing info-mediaries Journal
77,Brent Henson,R77_P30,Hard can when down,Brent Henson; Abigail Estes,1,462,2000,Switchable clear-thinking frame Journal
77,Brent Henson,R77_P31,Answer story property edge travel fight foot,Brent Henson; Mrs. Toni Cameron MD; Jane Davis; Michael Gray; Wendy Bell; Cole Coleman; Debra Cummings; Derek Soto,7,312,2002,Visionary background secured line Journal
77,Brent Henson,R77_P32,Accept born hear politics prevent federal general find,Brent Henson; Douglas Vincent; Erin Hampton,2,346,2003,Profit-focused asymmetric access Journal
77,Brent Henson,R77_P33,Near western level organization international back,Brent Henson; Amber Scott; Kelly Jones; Emily Taylor; Christopher Gonzalez; Samantha Munoz; Alan Collins; Desiree Peterson; Matthew Gray,8,370,2021,Quality-focused mobile data-warehouse Journal
77,Brent Henson,R77_P34,Purpose pass memory stuff,Brent Henson; Daniel Johnson; Roger Allen DVM,2,134,1999,Adaptive empowering help-desk Journal
77,Brent Henson,R77_P35,Site develop interview tax arrive,Brent Henson; Brianna Banks; Evelyn Williams; Howard Murphy; Jason Holloway; Debbie Harris; Rose Cooper,6,346,2006,Persevering contextually-based concept Journal
77,Brent Henson,R77_P36,Shoulder such benefit quality get,Brent Henson; Jessica Thomas; James Brown; Justin Mann; David Smith; David Lyons,5,136,2010,Expanded non-volatile Local Area Network Journal
78,Samuel Carter,R78_P1,Red its information response,Samuel Carter; Vanessa Moore; Dylan Mckenzie; Andrew Martinez; Laura White; David Ward; Thomas Lopez; Emma Berry; Tanner Cunningham,8,89,1992,Cloned real-time pricing structure Journal
78,Samuel Carter,R78_P2,Everything main compare establish knowledge green hand,Samuel Carter; Jose Waters; Stacy Lambert; Christina Lopez DDS; Raymond Brown; Aaron Jackson; Danielle Schneider; Tracie Snyder,7,176,1999,Distributed fresh-thinking architecture Journal
78,Samuel Carter,R78_P3,Condition feeling say Democrat society,Samuel Carter; Reginald Rivera; Donna Hunter; Crystal Coleman; Christina Steele; Jacob Mitchell; Scott Hurley,6,100,2007,Expanded secondary time-frame Journal
78,Samuel Carter,R78_P4,Common ask as cultural world smile,Samuel Carter; Samuel Bentley; Joseph Berry; Michelle Haas; Dawn Garcia; Richard Perry; Joshua Beck; Robert Fuentes; Steve Baldwin; George Cox,9,400,1981,Team-oriented dynamic system engine Journal
78,Samuel Carter,R78_P5,Mention carry check great else energy call clearly,Samuel Carter; Lori Gutierrez; Mrs. Elizabeth Flores DVM,2,24,2020,Enhanced bandwidth-monitored instruction set Journal
78,Samuel Carter,R78_P6,Entire by pay,Samuel Carter; Scott Snyder MD; Ronald Miller; Harry Jacobs; Jay Evans; Christopher Parks; Henry Adams; Amanda Lee; Noah Thornton; Shawn Farrell,9,133,2017,Customer-focused global project Journal
78,Samuel Carter,R78_P7,Easy customer nature government future case whom,Samuel Carter; Monica Kim; Lorraine Smith,2,389,2019,Organic attitude-oriented open system Journal
78,Samuel Carter,R78_P8,Exist would on address partner pattern,Samuel Carter; Lawrence Miller; Alexandria Dominguez; Todd Esparza; Lisa Robinson; Ashley Hudson; Stacie Burton; Wayne Pruitt,7,258,2014,Enterprise-wide didactic groupware Journal
78,Samuel Carter,R78_P9,Community white base receive,Samuel Carter; Charles Davis; Johnny Durham; Jennifer Robinson; Jody Cook; Shawn Johnson; Robin Munoz; Jeffrey Reynolds; Kim Li,8,224,1998,Persevering encompassing info-mediaries Journal
78,Samuel Carter,R78_P10,Become claim attack Republican,Samuel Carter; Heather Charles,1,145,2003,User-friendly encompassing data-warehouse Journal
78,Samuel Carter,R78_P11,Education left skin various safe range face cut,Samuel Carter; Hayden Simpson; Tara Becker; Dr. Julia Berry MD,3,236,1980,Configurable fault-tolerant standardization Journal
78,Samuel Carter,R78_P12,Nature particular part write test federal,Samuel Carter; Christopher Garcia; Patricia Jackson; Gregory Kane; Jessica Coleman; Pam Sherman; Ashley Williams; Matthew Salas; Monica Montgomery; Caleb Maynard,9,483,2022,Self-enabling needs-based paradigm Journal
78,Samuel Carter,R78_P13,Group arrive give,Samuel Carter; Michele Craig; Don Martin; Jennifer Robinson; Benjamin White; Elizabeth Taylor; Melissa Lyons; Cassandra Peterson; Misty Smith; David Herrera,9,481,1995,User-friendly bi-directional frame Journal
78,Samuel Carter,R78_P14,Everybody happen down number reduce run sure month,Samuel Carter; Mario Chavez; Whitney Gordon; Keith Kelley,3,225,2002,Configurable logistical forecast Journal
78,Samuel Carter,R78_P15,Fill woman his but,Samuel Carter; Christopher Wang; Robert Smith; Philip Mcdonald; Lisa Craig; Thomas Guerra; Lisa Jones; Daniel Wilson; Michael Bell; Jonathan Wells,9,210,1995,Reactive bi-directional concept Journal
78,Samuel Carter,R78_P16,Together dog shake TV nearly,Samuel Carter; Jacob Mcdonald; Andrew Wilson II; Adam Buckley,3,181,1988,Public-key human-resource application Journal
78,Samuel Carter,R78_P17,Tree indeed knowledge edge top course town,Samuel Carter; Brian Davis; Darrell Roberts; Rachel Turner,3,128,2012,Enterprise-wide global implementation Journal
78,Samuel Carter,R78_P18,Culture happy third adult they past,Samuel Carter; Maria Delgado MD; Danielle Kelly; Grant Trevino; Jessica Miller; Jason Meadows; Bradley Reilly; Clinton Fischer; Charles Nguyen,8,417,1997,Digitized incremental projection Journal
78,Samuel Carter,R78_P19,Rise statement other several nothing Republican,Samuel Carter; Jennifer Beltran; Joshua Murillo; Christopher Caldwell; William Hughes Jr.; Brandon Gonzalez; Rachel Davidson; Andrew Parker; Kathryn Smith; Stacy Smith,9,33,1985,Extended fault-tolerant migration Journal
78,Samuel Carter,R78_P20,Plant when practice number education tend put,Samuel Carter; Travis Fuller; Timothy Michael; Timothy Cross; Shane Valentine; Erik Mitchell; Jason Wong,6,20,2011,Open-architected dedicated circuit Journal
78,Samuel Carter,R78_P21,Long figure look talk control other,Samuel Carter; Cory Stafford; David Walker; Reginald Doyle DVM; Brandy Davis; Christopher Dodson; Karen Morrison; Edward Morrison,7,360,2010,Visionary mission-critical pricing structure Journal
78,Samuel Carter,R78_P22,Build same great week window school,Samuel Carter; Kimberly Aguilar; Michael Sanders; Kaylee White; Jonathan Knight; Andrea Osborne; Krystal James; Timothy Gilbert; Cheryl Dennis; Jodi George,9,489,1997,Secured bandwidth-monitored moratorium Journal
78,Samuel Carter,R78_P23,Interest address area,Samuel Carter; Patricia Mitchell; Karen Hood; Pam Jones; Chad Lewis; Marie Mckee; Lori Moyer; Sandra Park; Melissa Taylor,8,443,1988,Reactive motivating groupware Journal
78,Samuel Carter,R78_P24,Check culture smile drug save change difference,Samuel Carter; Megan Jones; Tina Sims; Lauren Hines DDS; Kimberly Stanley,4,478,2019,Self-enabling coherent alliance Journal
78,Samuel Carter,R78_P25,Yard hope join mouth choose hot play,Samuel Carter; Catherine Watkins; Shane Abbott; Brian Scott; Jordan Morgan; Alexander Powell; Janet Brown; Valerie Hawkins; Keith Sims; Michele Thomas,9,8,2005,Robust cohesive intranet Journal
79,Kevin Miller,R79_P1,Military down positive,Kevin Miller; Zoe Roach; Krista Fischer; Tyler Kim,3,208,1984,Expanded 24/7 task-force Journal
79,Kevin Miller,R79_P2,Personal yet your,Kevin Miller; Diana Chung; Douglas Allen; Jessica Petersen; Laura Eaton; Brenda Meyer,5,246,1999,Open-source dynamic core Journal
79,Kevin Miller,R79_P3,Someone important purpose option,Kevin Miller; Tonya Lamb; Anthony Figueroa,2,78,1981,Streamlined empowering task-force Journal
79,Kevin Miller,R79_P4,Discussion drive billion majority without save,Kevin Miller; Mr. Billy Sanchez; Christopher Perry; Lindsay Martinez; Ian Wiley,4,92,2021,Visionary full-range budgetary management Journal
79,Kevin Miller,R79_P5,Base it fire military year budget,Kevin Miller; Ricardo Klein; Jonathan Shaffer; Colton Cohen; Rebecca Garcia; Christopher Munoz; George Barton; Megan Peterson; Brett Richardson; Bryan Blackburn,9,108,1987,Public-key demand-driven moderator Journal
79,Kevin Miller,R79_P6,Capital she have,Kevin Miller; Madeline Vargas; Christopher Vargas; Devin Williams; Charles Allen; Robert Ross; Jennifer Thomas; Justin White; Mackenzie Hawkins; Kayla Parks,9,66,2009,Cross-platform executive info-mediaries Journal
79,Kevin Miller,R79_P7,Take cup west director,Kevin Miller; Dr. Paul Bailey Jr.; Pamela Moran; William Fritz,3,116,2016,Persevering background moratorium Journal
79,Kevin Miller,R79_P8,Clearly behind box bad fear memory find,Kevin Miller; Anna Stevenson; Alisha Wolf; Keith Patel; Bridget Murphy,4,297,1992,Realigned 4thgeneration contingency Journal
80,Eric Frederick,R80_P1,Upon opportunity information,Eric Frederick; Lisa Wright; Antonio Garcia; Melvin Gonzalez; Alexander Parsons; Andrea Smith; Ashley Jennings; Nicholas Bond; Michael Craig,8,36,1988,Versatile 3rdgeneration task-force Journal
80,Eric Frederick,R80_P2,Mission call finally model street audience black home,Eric Frederick; Charles Norman; David Nguyen; Samuel Parker; Carolyn Gibbs; Jennifer Gonzalez; Brittany Mann; Jennifer Clements,7,307,1981,Devolved secondary algorithm Journal
80,Eric Frederick,R80_P3,Weight local red ten attention,Eric Frederick; Amy Brown; Jessica Colon; Dana Kim; Joshua Cox; Cindy Reed; Molly Livingston; Renee Torres; Sean Diaz,8,245,2002,Future-proofed optimal service-desk Journal
80,Eric Frederick,R80_P4,Story fish which himself,Eric Frederick; Diana Becker; James Ellis; Raymond Blackburn; Samantha Taylor; Alicia Boyd; Melissa Garrett; Cheryl Richardson; Mark Stokes,8,102,2018,Persevering background website Journal
80,Eric Frederick,R80_P5,Case leave back agreement Republican suggest,Eric Frederick; Chelsea Wiggins; Lori Brewer; Sara Butler; Megan Caldwell; Natalie Lee; David Ramirez; Kevin Sawyer,7,340,2008,Open-source contextually-based hierarchy Journal
80,Eric Frederick,R80_P6,Candidate test real about Republican,Eric Frederick; Kevin Cunningham; Keith Ramirez; John Li,3,205,1984,Proactive needs-based hub Journal
80,Eric Frederick,R80_P7,Street turn prevent product administration,Eric Frederick; Amanda Morgan; Aaron Flowers; John Chambers; Linda Bishop; Brenda Stark; Kristy Nelson; Larry Jones; Laura Rodriguez; Patricia Fisher,9,222,2010,Operative grid-enabled neural-net Journal
80,Eric Frederick,R80_P8,Could card only we bag red home,Eric Frederick; Vincent Mcclure; Michael Flores; Michelle Becker; Taylor Kramer,4,433,2023,Future-proofed multi-tasking system engine Journal
80,Eric Frederick,R80_P9,Group evening music pass,Eric Frederick; Kimberly Miller,1,182,1981,Team-oriented human-resource process improvement Journal
80,Eric Frederick,R80_P10,Election strategy some sell,Eric Frederick; Isaiah Sparks; Kaitlyn Frederick; Jeffrey Baker; Kimberly Stephens; Sheila Golden; Kim Nicholson; Jose Vargas,7,152,2007,Sharable empowering attitude Journal
80,Eric Frederick,R80_P11,Thought both officer moment artist,Eric Frederick; Sara Miller; Alison Allen; Robyn Clarke; Christy Mercer; Kimberly Duran; Steven Smith; Eric Patel,7,105,1985,Multi-layered 4thgeneration attitude Journal
80,Eric Frederick,R80_P12,Subject until continue improve class trouble,Eric Frederick; Jonathan Duncan; Fernando Phillips; Jonathan Lara,3,194,1997,Synergized upward-trending customer loyalty Journal
80,Eric Frederick,R80_P13,With walk among trip,Eric Frederick; Tyler Hughes; John Pham; Amy Orr; April Oliver; Michelle Bishop; Madeline Conner,6,74,1999,Fully-configurable well-modulated conglomeration Journal
80,Eric Frederick,R80_P14,Information let others head begin always resource,Eric Frederick; Nicholas Martin; Mr. Benjamin Krause; Linda Thomas; Jesse Herman; Michele Brooks,5,191,1998,Profit-focused even-keeled infrastructure Journal
80,Eric Frederick,R80_P15,Fear available interview successful shoulder,Eric Frederick; Amanda Solomon; Stephanie Crawford; Robert Stein,3,213,1995,Assimilated analyzing task-force Journal
80,Eric Frederick,R80_P16,Late music condition TV,Eric Frederick; Michael Flores; Bruce Perez; James Figueroa; Mary Lopez; Claire Vance; William Lee; Crystal Owens; Sydney Fisher,8,383,2020,Enterprise-wide 3rdgeneration complexity Journal
81,Thomas Walls,R81_P1,Store everyone whose family executive,Thomas Walls; William Munoz; Monica Clay; John Schultz; Ricky Moreno; Jessica Watson; Holly Rowe; Destiny West; James Maldonado; Lisa Hansen,9,14,2023,Networked needs-based Graphic Interface Journal
81,Thomas Walls,R81_P2,Certain project make those for beat,Thomas Walls; Joseph Allen; Andrea Mitchell DVM; Jessica Wallace,3,438,1993,Multi-lateral background initiative Journal
81,Thomas Walls,R81_P3,Knowledge return west young cover model keep simply,Thomas Walls; Dr. Kathleen Russo DVM; Shelly Contreras; Kelly Reyes,3,432,2017,Open-source zero-defect customer loyalty Journal
81,Thomas Walls,R81_P4,Room company across rather air,Thomas Walls; Erika Nichols; Christopher Morrow; Dennis Russell; Nathan Mathews; Hannah Miller; Steven Rhodes; Joseph Fuller,7,99,2009,Synchronized transitional toolset Journal
81,Thomas Walls,R81_P5,Another see rule produce interview skin TV effect,Thomas Walls; Rhonda Logan,1,466,2004,Profit-focused secondary matrices Journal
81,Thomas Walls,R81_P6,Note pass leg blood today reach,Thomas Walls; Sean White; Oscar Baker; Steven Rogers; Taylor Burke; Kristina Church; Christina Stewart,6,143,2019,Customer-focused modular access Journal
81,Thomas Walls,R81_P7,Accept staff city this,Thomas Walls; Angela Delgado; Amy Miller; Joseph Johnson; Kim Ramos; Robin Cook; John Roberts; Brittany White; Andrea Anderson,8,178,1997,Multi-tiered needs-based encoding Journal
81,Thomas Walls,R81_P8,Society play indeed oil risk enjoy military,Thomas Walls; Jose Smith; Kyle Hess; Charles Hooper MD; Don Rogers,4,219,1998,Switchable tertiary architecture Journal
82,Brian Holland,R82_P1,Else federal support modern,Brian Holland; Joshua Mendez; Antonio Ross; Laura Mcdonald; Anthony Butler; Jessica Sullivan; Ms. Kim Knight; Cassandra Adams,7,272,2006,Persistent actuating product Journal
82,Brian Holland,R82_P2,Bank road range someone reach,Brian Holland; Travis Ellis; Melissa Wilcox,2,9,2015,Virtual exuding info-mediaries Journal
82,Brian Holland,R82_P3,Century also whatever available,Brian Holland; Victoria Brewer; Angela Reyes; Frederick Larsen; Maureen Martin; Adam Miranda; Jodi Alvarez,6,408,2003,Reverse-engineered multi-state array Journal
